{
  "$schema": "https://recursive-dev-loop.dev/schemas/execution-receipt.v1.schema.json",
  "schema_version": "1.0.0",
  "receipt_id": "rcp-task-001-refund-cd70bb0d",
  "created_at": "2026-08-31T00:26:02.520Z",
  "candidate_sha256": "715ea6a4702f78450a93fe934627c1823db31b7b43981f1cf70a9847dde078a2",
  "base_generation_id": "g1",
  "candidate_generation_id": "g1",
  "effective_composition_sha256": "84b2972cd6b2136904920a4c783393d61bc1c445463fb0031ffec3f51cb52531",
  "task_handle": "task-001-refund",
  "model": {
    "provider": "deepseek-official",
    "model": "deepseek-v4-flash"
  },
  "model_patch_sha256": "249b32b8f5b53bdefc03e111f6ca37dfe5a8dce0971b63f81b76ba5f6b65fee0",
  "dsh_session_id": null,
  "event_log_head_sha256": "5c58cbdbe1cbf7bfd16884c4bac6c8ad01d6cb487368694feefb8280897241fc",
  "external_state_before_sha256": "9995cd4f463c93c6e0a0a5675932cdfcddf7ba1b0db3564fe50040c3ba362dac",
  "external_state_after_sha256": "74ed08a9b38db2336da88913c8efb543ae930ae19464b82783f8faf19827eada",
  "grader_receipt_sha256": "88e570af3aae6b93e1d4c8af35f26270d83aa54471c0141fc01eea8b2ef8b89b",
  "source": "repo://benchmarks/tau-style-workflow/run-e2e.ts",
  "business_outcome": {
    "status": "passed",
    "source": "repo://benchmarks/tau-style-workflow/grader/grade.ts",
    "score": 1,
    "earned": 3,
    "total": 3
  }
}
