{
  "$schema": "https://recursive-dev-loop.dev/schemas/execution-receipt.v1.schema.json",
  "schema_version": "1.0.0",
  "receipt_id": "rcp-task-003-policy-refusal-e9fc2670",
  "created_at": "2026-08-30T22:19:40.468Z",
  "candidate_sha256": "715ea6a4702f78450a93fe934627c1823db31b7b43981f1cf70a9847dde078a2",
  "base_generation_id": "g0",
  "candidate_generation_id": "g0",
  "effective_composition_sha256": "84b2972cd6b2136904920a4c783393d61bc1c445463fb0031ffec3f51cb52531",
  "task_handle": "task-003-policy-refusal",
  "model": {
    "provider": "deepseek-official",
    "model": "deepseek-v4-flash"
  },
  "model_patch_sha256": "249b32b8f5b53bdefc03e111f6ca37dfe5a8dce0971b63f81b76ba5f6b65fee0",
  "dsh_session_id": null,
  "event_log_head_sha256": null,
  "external_state_before_sha256": "1afdc25703226e0f8d42488c2fa26506792f5de8d36661b0d00173b61fda8036",
  "external_state_after_sha256": "9a0918399928e208b741d4149469d7a6f7d1aee154d4e1209f502c0dc668b044",
  "grader_receipt_sha256": "30c2085d0fde207b777b1c687264466f99649c05f9d05d6c8e03ba735b59a632",
  "source": "repo://benchmarks/tau-style-workflow/run-e2e.ts",
  "business_outcome": {
    "status": "failed",
    "source": "repo://benchmarks/tau-style-workflow/grader/grade.ts",
    "score": 0.6666666666666666,
    "earned": 2,
    "total": 3
  }
}
